{
  "schema_version": 1,
  "title": "Add project health summary",
  "objective": "Add a read-only command that summarizes project configuration health.",
  "scope": {
    "included": ["Command output and portable tests"],
    "excluded": ["Worker execution and remote mutation"]
  },
  "constraints": ["Preserve the provider-neutral core boundary"],
  "tasks": [
    {
      "id": "health-summary",
      "type": "change",
      "title": "Implement health summary",
      "objective": "Implement and validate the read-only summary command.",
      "depends_on": [],
      "acceptance_criteria": ["The command reports valid and invalid project configuration clearly."],
      "validation": ["./scripts/check.sh"],
      "delivery_expectation": "project-default",
      "worker_profile_hint": null
    }
  ],
  "acceptance_criteria": ["The project health summary is documented and tested."],
  "assumptions": [],
  "risks": [],
  "missing_information": [],
  "unresolved_decisions": [],
  "references": []
}
